{
  "$schema": "https://json-schema.org/draft/2020-12/schema",
  "$id": "https://assetforge.dev/schemas/asset_spec.schema.json",
  "title": "AssetSpec",
  "description": "Single shared spec that drives the Three.js preview, the Blender builder, and the auto-generated UI controls.",
  "type": "object",
  "additionalProperties": false,
  "required": ["asset_type", "name", "units", "parameters"],
  "properties": {
    "asset_type": {
      "type": "string",
      "description": "Builder key, e.g. street_light, pedestrian_lamp, bench, bollard, traffic_sign, trash_bin, planter, hydrant.",
      "pattern": "^[a-z][a-z0-9_]*$"
    },
    "name": {
      "type": "string",
      "minLength": 1,
      "maxLength": 120
    },
    "units": {
      "enum": ["imperial", "metric"],
      "description": "Display units for the UI. Individual parameters carry their own unit."
    },
    "code_mode": {
      "enum": ["strict", "advisory"],
      "default": "strict",
      "description": "strict = clamp values to US-code ranges; advisory = warn only (movie/animation props)."
    },
    "parameters": {
      "type": "array",
      "items": {
        "type": "object",
        "additionalProperties": false,
        "required": ["id", "label", "type", "value"],
        "properties": {
          "id": { "type": "string", "pattern": "^[a-z][a-z0-9_]*$" },
          "label": { "type": "string" },
          "type": { "enum": ["slider", "number", "select"] },
          "min": { "type": "number" },
          "max": { "type": "number" },
          "step": { "type": "number", "exclusiveMinimum": 0 },
          "value": { "type": ["number", "string"] },
          "unit": { "enum": ["ft", "in", "m", "cm", "mm"] },
          "options": {
            "type": "array",
            "items": { "type": "string" },
            "description": "Only for type=select (e.g. lantern style: acorn, teardrop, modern)."
          },
          "code_ref": {
            "type": "string",
            "description": "Key or citation into /standards/us_codes.json, e.g. AASHTO-RDG-lighting, MUTCD-2A.18."
          }
        }
      }
    },
    "toggles": {
      "type": "array",
      "default": [],
      "items": {
        "type": "object",
        "additionalProperties": false,
        "required": ["id", "label", "value"],
        "properties": {
          "id": { "type": "string", "pattern": "^[a-z][a-z0-9_]*$" },
          "label": { "type": "string" },
          "value": { "type": "boolean" }
        }
      }
    },
    "materials": {
      "type": "array",
      "default": [],
      "items": {
        "type": "object",
        "additionalProperties": false,
        "required": ["slot", "preset"],
        "properties": {
          "slot": { "type": "string" },
          "preset": {
            "enum": [
              "galvanized_steel",
              "powder_coat_black",
              "powder_coat_green",
              "cast_iron",
              "concrete",
              "brushed_aluminum",
              "wood_slat",
              "lamp_lens"
            ]
          },
          "color": {
            "type": "string",
            "pattern": "^#[0-9a-fA-F]{6}$",
            "description": "Overrides the preset base color."
          },
          "metalness": { "type": "number", "minimum": 0, "maximum": 1 },
          "roughness": { "type": "number", "minimum": 0, "maximum": 1 },
          "uv_scale": {
            "type": "number",
            "minimum": 0.05,
            "maximum": 20,
            "description": "Texture tiling density; applied to procedural surface detail in the preview and to texture mapping in Blender."
          },
          "emission": {
            "type": "number",
            "minimum": 0,
            "maximum": 20,
            "description": "Emission strength (e.g. lamp lenses glow)."
          },
          "weathering": {
            "type": "number",
            "minimum": 0,
            "maximum": 1,
            "description": "Aging: 0 = factory-new, 1 = heavily weathered. Darkens toward grime, raises roughness, and dulls metals in both preview and Blender. Great for movie/animation dressing."
          },
          "finish": {
            "enum": ["cast", "machined", "sheet", "rough"],
            "description": "Fabrication finish of this slot's parts, tuning the surface: cast (matte, soft), machined (crisp, semi-gloss), sheet (smooth panel), rough (raw/galvanized). Advisory for the Blender finishing pass; does not change dimensions."
          }
        }
      }
    },
    "primitives": {
      "type": "array",
      "description": "Custom parametric geometry for asset types without a curated builder ('generate anything' path). All dimensions are METERS, +Z up, asset grounded at z=0. Numeric fields accept expressions over parameter/toggle ids, e.g. 'seat_height + 0.02' (allowed: numbers, ids, + - * / parentheses, min(), max(), abs(); toggles evaluate to 0 or 1).",
      "items": {
        "type": "object",
        "additionalProperties": false,
        "required": ["kind", "params"],
        "properties": {
          "kind": {
            "enum": ["cylinder", "cone", "box", "sphere", "lathe", "sweep", "loft", "tube"],
            "description": "lathe: revolve a profile around Z (lantern globes, finials, domes, planters). sweep: round tube following a 3D path with optional taper (mast arms, handrails, pipe runs). loft: taper between two cross-sections (cobra heads, flared transitions). tube: hollow cylinder with wall thickness (real poles/bollards are not solid)."
          },
          "name": { "type": "string" },
          "component": { "type": "string", "default": "body" },
          "location": {
            "type": "array",
            "minItems": 3,
            "maxItems": 3,
            "items": { "type": ["number", "string"] }
          },
          "rotation": {
            "type": "array",
            "minItems": 3,
            "maxItems": 3,
            "items": { "type": ["number", "string"] },
            "description": "Euler XYZ radians."
          },
          "material_slot": { "type": "string" },
          "visible_if": {
            "type": "string",
            "description": "Expression; primitive is skipped when it evaluates to 0 (use toggle ids)."
          },
          "cut": {
            "type": "boolean",
            "default": false,
            "description": "Negative space: this primitive is boolean-SUBTRACTED from the other parts of its component (bolt holes, slots, cutouts) instead of being rendered."
          },
          "array": {
            "type": "object",
            "additionalProperties": false,
            "required": ["count", "step"],
            "description": "Linear repetition: expands this primitive into `count` copies offset by `step` each (fence pickets, slats, bolt rows).",
            "properties": {
              "count": { "type": ["number", "string"] },
              "step": {
                "type": "array",
                "minItems": 3,
                "maxItems": 3,
                "items": { "type": ["number", "string"] }
              }
            }
          },
          "params": {
            "type": "object",
            "additionalProperties": false,
            "properties": {
              "radius": { "type": ["number", "string"] },
              "depth": { "type": ["number", "string"] },
              "radius_bottom": { "type": ["number", "string"] },
              "radius_top": { "type": ["number", "string"] },
              "size": {
                "type": "array",
                "minItems": 3,
                "maxItems": 3,
                "items": { "type": ["number", "string"] }
              },
              "segments": {
                "type": ["number", "string"],
                "description": "Radial segments for cylinders/cones (default 24; use 6 for hex bolt heads and nuts)."
              },
              "shell": {
                "type": ["number", "string"],
                "description": "Wall thickness in meters: turns the part into hollow sheet/cast construction (luminaire housings, bins, shades). Applied as a solidify pass in Blender."
              },
              "profile": {
                "description": "For kind=lathe: a named profile (acorn, teardrop, dome, finial, flared_base, vase — scaled by radius+depth) or a raw [[r,z],...] point list in meters, z from 0 (bottom, at the primitive's location) upward.",
                "oneOf": [
                  { "enum": ["acorn", "teardrop", "dome", "finial", "flared_base", "vase"] },
                  { "type": "array", "minItems": 3,
                    "items": { "type": "array", "minItems": 2, "maxItems": 2,
                               "items": { "type": ["number", "string"] } } }
                ]
              },
              "path": {
                "type": "array",
                "minItems": 2,
                "description": "For kind=sweep: 3D points (relative to location, meters) the tube follows.",
                "items": { "type": "array", "minItems": 3, "maxItems": 3,
                           "items": { "type": ["number", "string"] } }
              },
              "radius_end": {
                "type": ["number", "string"],
                "description": "For kind=sweep: tip radius (tapers from radius to radius_end along the path)."
              },
              "wall": {
                "type": ["number", "string"],
                "description": "For kind=tube: wall thickness in meters."
              },
              "profile_start": {
                "type": "object",
                "additionalProperties": false,
                "required": ["shape", "w", "h"],
                "description": "For kind=loft: cross-section at -depth/2 along local Z.",
                "properties": {
                  "shape": { "enum": ["rect", "ellipse"] },
                  "w": { "type": ["number", "string"] },
                  "h": { "type": ["number", "string"] }
                }
              },
              "profile_end": {
                "type": "object",
                "additionalProperties": false,
                "required": ["shape", "w", "h"],
                "description": "For kind=loft: cross-section at +depth/2 along local Z.",
                "properties": {
                  "shape": { "enum": ["rect", "ellipse"] },
                  "w": { "type": ["number", "string"] },
                  "h": { "type": ["number", "string"] }
                }
              }
            }
          }
        }
      }
    },
    "offsets": {
      "type": "object",
      "description": "Per-component ('pole') or per-part ('pole/shaft') position nudges in meters, applied after building. Component and part offsets stack. Lets users reposition individual parts in the editor; honored identically by the Blender export.",
      "additionalProperties": {
        "type": "array",
        "minItems": 3,
        "maxItems": 3,
        "items": { "type": "number" }
      }
    },
    "components": {
      "type": "array",
      "items": { "type": "string" },
      "description": "Named component hierarchy; exported as nested DAE nodes so SketchUp imports editable sub-components."
    },
    "seed": {
      "type": "integer",
      "default": 42,
      "description": "Deterministic seed for organic detail (weathering, UV offsets)."
    }
  }
}
